{
  "schema_version": "1.0.0",
  "slice_id": "slice-010",
  "audit_date": "2026-04-14",
  "verdict": "approved",
  "summary": "Spec completo e consistente após correção da rodada 3 (user_agent_hash em AC-003/AC-004). Todos os 7 checks passam com zero findings.",
  "checks": {
    "scope_boundary": {
      "status": "pass",
      "details": "Slice entrega exatamente E02-S07 (base legal LGPD + consentimentos). Fora de escopo cobre acoplamento com Contact (E03) e portal do titular (E09). Dependências slice-008 e slice-009 declaradas. Roadmap confirma NNN=010 com depende de TEN-002."
    },
    "ac_quality": {
      "status": "pass",
      "details": "22 ACs (8 happy path + 9 edge cases + 5 segurança). IDs sequenciais AC-001..AC-008, AC-001a/b, AC-002a, AC-003a/b, AC-004a/b, AC-007a, AC-008a, AC-SEC-001..AC-SEC-005. Cada AC tem comportamento, entrada e resultado esperado observável. AC-003 e AC-004 gravam 'user_agent_hash' (SHA-256), alinhados com ERD (coluna user_agent_hash) e AC-SEC-003. Sem ACs vagos ou duplicados."
    },
    "testability": {
      "status": "pass",
      "details": "Cada AC tem caminho de teste automatizado identificável: trigger append-only testável via integração PostgreSQL real (disponível desde slice-001), envio de e-mail testável com fake mailer (queue worker desde slice-008), canReceiveOn testável como unit test de lógica pura, token de revogação testável com comparação de hash. Nenhum AC depende de julgamento visual humano."
    },
    "security_privacy": {
      "status": "pass",
      "details": "AC-SEC-003 explicita ausência de PII raw em consent_records. AC-003 e AC-004 gravam user_agent_hash (SHA-256), nunca raw — alinhado com ERD. AC-SEC-004 garante token hash SHA-256 de random 32 bytes com expires_at e validação via hash_equals. AC-SEC-005 impõe comparação constant-time. AC-007a retorna HTTP 404 sem enumerar subjects. revocation_reason de enum fixo evita PII em texto livre. Isolamento de tenant via RLS + ScopesToCurrentTenant (AC-SEC-002). 2FA enforced em /settings/privacy (AC-001b)."
    },
    "dependencies": {
      "status": "pass",
      "details": "ADR-0001 (stack Laravel 13 + Livewire 4) e ADR-0004 (Fortify/Sanctum) declarados. Middleware EnsureTwoFactorAuthenticated existente desde slice-007. Queue worker existente desde slice-008. PostgreSQL 18 com triggers declarado. ERD erd-e02-auth.md referenciado — tabelas lgpd_categories, consent_records, consent_subjects e revocation_tokens presentes com colunas corretas. Wireframe SCR-E02-009 referenciado. Nenhum ADR novo requerido."
    },
    "product_alignment": {
      "status": "pass",
      "details": "Valor claro como desbloqueio jurídico antes do E03 (LGPD Art. 7, REQ-CMP-004, FR-SEG-03, FR-EML-04). Jornada alvo coerente com persona gerente do laboratório. Slice bem dimensionado para planejar/testar/implementar. Riscos declarados com mitigações específicas (trigger, índice em consent_records, retry de e-mail com alerta, enum de revocation_reason)."
    },
    "documentation_gate": {
      "status": "pass",
      "details": "Slice tem UI (/settings/privacy e /settings/privacy/consentamentos). Documentos obrigatórios existem: wireframes-e02-auth.md (SCR-E02-009), erd-e02-auth.md, e roadmap confirma 'documentacao por epico E02 ja consumida'."
    }
  },
  "findings": [],
  "stats": {
    "total_checks": 7,
    "passed": 7,
    "failed": 0,
    "findings_critical": 0,
    "findings_major": 0,
    "findings_minor": 0
  }
}
