{
  "schema_version": "1.0.0",
  "slice_id": "slice-014",
  "audit_date": "2026-04-16",
  "verdict": "approved",
  "summary": "Todos os findings resolvidos. SP-011 corrigido: regra de unicidade do campo 'principal' declarada explicitamente fora de escopo com texto claro ('neste slice o campo é apenas boolean sem constraint de unicidade'). Zero findings em todos os 7 checks.",
  "checks": {
    "scope_boundary": {
      "status": "pass",
      "details": "Consentimentos corretamente declarados fora de escopo (E03-S02b). Regra de unicidade de 'principal' declarada fora de escopo com slice posterior identificado. Fronteira coerente com E03-S02a. Dependência slice-013 declarada. Fora de escopo remove ambiguidades relevantes."
    },
    "ac_quality": {
      "status": "pass",
      "details": "AC-001 a AC-017 têm formato Dado/Quando/Então com comportamentos observáveis e HTTP codes objetivos. Happy paths cobertos (201, 200). Edge cases cobertos: payload vazio → 422 (AC-004), contato já inativo → 409 (AC-007), cross-tenant → 404 (AC-008, AC-013, AC-014), validação condicional email/whatsapp → 422 (AC-015), cliente_id imutável no PUT (AC-017). RBAC explícito para técnico (AC-005, AC-006, AC-009, AC-010). Campo 'principal' retornado no AC-016 sem regra de negócio associada — comportamento correto dado que unicidade está fora de escopo com declaração explícita. IDs sequenciais AC-001 a AC-017."
    },
    "testability": {
      "status": "pass",
      "details": "Todos os 17 ACs são testáveis via Pest Feature tests com entradas e saídas objetivas. Backend-only sem integrações externas neste slice. Nenhuma dependência de julgamento visual humano. Isolamento de tenant verificável por 404 automático."
    },
    "security_privacy": {
      "status": "pass",
      "details": "Isolamento declarado com tenant_id direto + FK cliente_id como segunda camada. RBAC cobre 403 para técnico em POST/PUT/DELETE (AC-005, AC-006, AC-009) e 404 para cross-tenant em GET/PUT/DELETE (AC-008, AC-013, AC-014). Dados pessoais (email, whatsapp) não expostos a tenants distintos. SoftDeletes + campo ativo declarados explicitamente. Resposta neutra (404) para cross-tenant não vaza existência de registros."
    },
    "dependencies": {
      "status": "pass",
      "details": "Modelo de dados inclui created_by, updated_by, deleted_at + SoftDeletes declarado explicitamente. ERD E03 §2.2 alinhado com spec. slice-013 declarado como dependência. Contrato de API (api-contracts/E03/contatos.md) e ERD (data-models/E03/erd.md) existem e foram verificados. Sem ADR bloqueante pendente."
    },
    "product_alignment": {
      "status": "pass",
      "details": "Valor claro para o laboratório: gerenciar contatos de clientes com RBAC e isolamento de tenant. Jornada coerente com personas (atendente cria/edita, técnico somente leitura) e roadmap E03. Slice delimitado (1 model, 17 ACs, backend-only). Riscos conhecidos com mitigação (enum extensível para 'papel')."
    },
    "documentation_gate": {
      "status": "pass",
      "details": "Slice é backend-only. Gate documental de UI não aplicável. Contrato de API (api-contracts/E03/contatos.md) e ERD (data-models/E03/erd.md) existem e foram verificados."
    }
  },
  "findings": [],
  "stats": {
    "total_checks": 7,
    "passed": 7,
    "failed": 0,
    "findings_critical": 0,
    "findings_major": 0,
    "findings_minor": 0
  }
}
