{
  "schema_version": "1.0.0",
  "slice_id": "slice-008",
  "audit_date": "2026-04-14",
  "verdict": "approved",
  "summary": "O spec cobre o primeiro laboratorio isolado conforme o roadmap, com escopo fechado, criterios testaveis, dependencias declaradas e riscos mitigados. Nao ha findings para corrigir antes do plano.",
  "checks": {
    "scope_boundary": {
      "status": "pass",
      "details": "O escopo entrega TEN-001: configuracao inicial do laboratorio, empresa raiz, filial raiz e isolamento de dados. Itens posteriores como usuarios, papeis, planos, LGPD, portal e suporte interno estao explicitamente fora de escopo."
    },
    "ac_quality": {
      "status": "pass",
      "details": "Os ACs AC-001 a AC-012 sao sequenciais, observaveis e descrevem pre-condicao, acao e resultado esperado. Os criterios de seguranca AC-SEC-001 a AC-SEC-003 complementam o isolamento e mensagens seguras."
    },
    "testability": {
      "status": "pass",
      "details": "Cada criterio pode virar teste automatizado de pagina, formulario, validacao, autorizacao, consistencia transacional, auditoria ou isolamento entre dois tenants."
    },
    "security_privacy": {
      "status": "pass",
      "details": "O spec cobre bloqueio para usuario sem papel gerente, modo somente leitura, vinculo invalido, IDs externos, input malicioso e mensagens que nao revelam dados de outro tenant."
    },
    "dependencies": {
      "status": "pass",
      "details": "As dependencias principais estao declaradas: slice-007, ADR-0001, ADR-0004, documentos do gate E02 e PostgreSQL para isolamento e consistencia."
    },
    "product_alignment": {
      "status": "pass",
      "details": "A jornada de Marcelo em /settings/tenant esta alinhada ao roadmap e aos documentos E02 para criar a base do laboratorio antes de usuarios, clientes, instrumentos e ordens de servico."
    },
    "documentation_gate": {
      "status": "pass",
      "details": "O spec referencia os documentos por epico exigidos para E02: wireframes, API contracts, ERD, migrations spec e fluxos de usuario."
    }
  },
  "findings": [],
  "stats": {
    "total_checks": 7,
    "passed": 7,
    "failed": 0,
    "findings_critical": 0,
    "findings_major": 0,
    "findings_minor": 0
  }
}
