{
  "schema_version": "1.0.0",
  "slice_id": "slice-007",
  "audit_date": "2026-04-13",
  "verdict": "approved",
  "summary": "O spec está coerente com o escopo do E02 auth, inclui o comportamento de tenant `suspended` em modo somente leitura e mantém os critérios testáveis e alinhados aos docs de contrato e fluxo. O gate documental E02 existe e as dependências declaradas são consistentes.",
  "checks": {
    "scope_boundary": {
      "status": "pass",
      "details": "O slice fica restrito a login seguro, recuperação de senha, 2FA e auditoria, sem avançar para setup de tenant, gestão avançada de usuários ou outros slices do E02."
    },
    "ac_quality": {
      "status": "pass",
      "details": "Os ACs estão numerados, são observáveis e cobrem happy path, erros e segurança com comportamento, entrada e resultado esperado."
    },
    "testability": {
      "status": "pass",
      "details": "Cada AC pode virar teste automatizado; os requisitos de mensagem neutra, rate limit, 2FA, auditoria e modo somente leitura são verificáveis."
    },
    "security_privacy": {
      "status": "pass",
      "details": "O spec evita enumeração de contas, proíbe vazamento de senha, token, segredo TOTP e recovery code, e trata tenant suspenso com autenticação neutra em modo somente leitura."
    },
    "dependencies": {
      "status": "pass",
      "details": "ADR-0001 e ADR-0004 estão referenciados, o gate documental E02 existe e as dependências externas relevantes estão listadas."
    },
    "product_alignment": {
      "status": "pass",
      "details": "A jornada atende o primeiro acesso seguro do laboratório e mantém o escopo pequeno o suficiente para implementação e validação."
    },
    "documentation_gate": {
      "status": "pass",
      "details": "Os documentos obrigatórios do gate E02 citados no spec foram encontrados: wireframes, API contract, ERD, migrations e flows."
    }
  },
  "findings": [],
  "stats": {
    "total_checks": 7,
    "passed": 7,
    "failed": 0,
    "findings_critical": 0,
    "findings_major": 0,
    "findings_minor": 0
  }
}
