{
  "schema_version": "1.0.0",
  "slice_id": "slice-012",
  "audit_date": "2026-04-15",
  "verdict": "approved",
  "summary": "Todos os 3 findings da iteracao 1 foram resolvidos: AC-007/AC-008 cobrem soft-delete, secao de nomenclatura alinha cnpj_cpf vs documento entre camadas, AC-009 cobre migration+seeder. 9 ACs testaveis, escopo alinhado com Story Contract E03-S01a.",
  "checks": {
    "scope_boundary": { "status": "pass", "details": "Spec entrega exatamente o item E03-S01a do roadmap. Fora de escopo consistente com Story Contract e epic E03. Dependencias anteriores (E02) declaradas." },
    "ac_quality": { "status": "pass", "details": "9 ACs sequenciais (AC-001 a AC-009) com formato Dado/Quando/Entao. Happy paths (AC-001, AC-002), edge cases de validacao (AC-003, AC-004), unicidade (AC-005), isolamento de tenant (AC-006), soft-delete (AC-007, AC-008), migration/seeder (AC-009). Sem duplicatas, sem ambiguidade." },
    "testability": { "status": "pass", "details": "Todos os 9 ACs sao observaveis por teste automatizado: AC-001 a AC-008 via HTTP feature tests, AC-009 via processo artisan com exit code. Integracao externa nao necessaria (validacao algoritmica local)." },
    "security_privacy": { "status": "pass", "details": "AC-006 verifica isolamento de tenant. AC-003/AC-004 validam input algoritmicamente. Nenhum dado sensivel exposto em responses. Soft-delete preserva dados sem exposicao indevida." },
    "dependencies": { "status": "pass", "details": "E02 completo declarado como dependencia. ADR-0001 (stack) vigente. ERD, API contract e wireframe referenciados e existentes." },
    "product_alignment": { "status": "pass", "details": "Valor claro para atendente: cadastrar clientes com validacao. Jornada coerente com persona e roadmap E03. Slice pequeno e focado em model + validacao + unicidade + soft-delete." },
    "documentation_gate": { "status": "pass", "details": "Wireframe clientes-form.md, ERD E03/erd.md e API contract E03/clientes.md existem e estao referenciados no spec." }
  },
  "findings": [],
  "stats": {
    "total_checks": 7,
    "passed": 7,
    "failed": 0,
    "findings_critical": 0,
    "findings_major": 0,
    "findings_minor": 0
  }
}
