{
  "schema_version": "1.0.0",
  "slice_id": "slice-011",
  "audit_date": "2026-04-15",
  "verdict": "approved",
  "summary": "Todos os 5 findings da auditoria anterior (SP-001..SP-005) foram corrigidos: ADR errado substituído por ADR-0001, AC-005 determinístico com dívida técnica em Riscos, AC-011 com comportamento único (rejeitar inteira com 403), config/tenancy-jobs.php declarado como criado neste slice, e AC-016 com status HTTP e assert de payload explícitos. Nenhum finding novo identificado.",
  "checks": {
    "scope_boundary": {
      "status": "pass",
      "details": "O slice entrega exatamente E02-S08 (gate de saída do E02). Fora de escopo cobre pen-test externo, escalação intra-tenant, logs/telemetria e storage — todos alinhados com o Story Contract. Nenhum trabalho de E03+ está incluído. Dependências de slices anteriores (001..010) declaradas."
    },
    "ac_quality": {
      "status": "pass",
      "details": "ACs sequenciais AC-001..AC-016 com IDs corretos. AC-005 define comportamento alvo único ('bloqueia merge'); dívida transitória de CI documentada exclusivamente em Riscos conhecidos, não no AC. AC-011 elegeu comportamento único (rejeitar inteira com 403). Happy paths têm edge cases correspondentes (AC-008..AC-015). Nenhum AC vago, duplicado ou subjetivo."
    },
    "testability": {
      "status": "pass",
      "details": "Cada AC pode virar teste red antes do código. AC-016 especifica status HTTP esperado (404 ou 403), assert de payload (sem campos do tenant B) e assert de log (tenant_context=A). AC-005 testável deterministicamente com comportamento alvo canônico. AC-014 referencia paths filter no workflow gates.yml (já existente). Integrações externas (stancl/tenancy, Pest 4 data providers) declaradas."
    },
    "security_privacy": {
      "status": "pass",
      "details": "AC-016 cobre SQL injection cross-tenant com assert completo. AC-010 cobre bypass via query string e header forjado. AC-013 cobre soft-deletes cross-tenant. AC-011 cobre batch de IDs com rejeição inteira. Fluxo de autenticação e tenant context tratados. LGPD aparece no contexto (consentimentos cobertos por slice-010 declarado como dependência). Nenhum dado sensível exposto na spec."
    },
    "dependencies": {
      "status": "pass",
      "details": "ADR-0001 (stack Laravel 13 + stancl/tenancy single-database + Pest) corretamente referenciado. ADR-0012 (dual-LLM gates) listado. config/tenancy-jobs.php declarado explicitamente como arquivo a ser criado neste slice. Bibliotecas externas (stancl/tenancy, Laravel Testing, Pest 4, GitHub Actions) listadas. Dependências de slices anteriores (001..010) declaradas."
    },
    "product_alignment": {
      "status": "pass",
      "details": "Valor para o PM claro: gate estrutural de isolamento antes de abrir E03, evidência para compliance LGPD. Alinhado com roadmap (E02 gate de saída, pré-condição de E03). Slice focado em testes — escopo implementável e verificável. Riscos têm mitigações concretas e específicas."
    },
    "documentation_gate": {
      "status": "pass",
      "details": "Este slice é exclusivamente de testes — não há UI nova. Gate documental de épico com UI não se aplica aqui."
    }
  },
  "findings": [],
  "stats": {
    "total_checks": 7,
    "passed": 7,
    "failed": 0,
    "findings_critical": 0,
    "findings_major": 0,
    "findings_minor": 0
  }
}
